{
  "request": "validate UpdateSkill upgrade suggestions for Claude Code CLI context and update UPGRADES.md",
  "effort": "STANDARD",
  "created": "2026-01-10T02:54:56.240Z",
  "lastModified": "2026-01-10T03:00:17.359Z",
  "phase": "OBSERVE",
  "iteration": 1,
  "rows": [
    {
      "id": 1,
      "description": "Understand Claude Code CLI vs Messages API architectural difference",
      "source": "EXPLICIT",
      "status": "DONE",
      "parallel": true,
      "timestamp": "2026-01-10T02:55:17.111Z"
    },
    {
      "id": 2,
      "description": "Read and analyze current UPGRADES.md suggestions",
      "source": "EXPLICIT",
      "status": "DONE",
      "parallel": true,
      "timestamp": "2026-01-10T02:55:19.664Z"
    },
    {
      "id": 3,
      "description": "Evaluate each upgrade for Claude Code CLI applicability",
      "source": "EXPLICIT",
      "status": "DONE",
      "parallel": true,
      "timestamp": "2026-01-10T02:55:22.323Z"
    },
    {
      "id": 4,
      "description": "Identify which suggestions are valid, invalid, or need modification",
      "source": "INFERRED",
      "status": "DONE",
      "parallel": true,
      "timestamp": "2026-01-10T02:55:24.945Z"
    },
    {
      "id": 5,
      "description": "Rewrite UPGRADES.md with corrected recommendations",
      "source": "EXPLICIT",
      "status": "DONE",
      "parallel": true,
      "timestamp": "2026-01-10T02:55:27.693Z"
    },
    {
      "id": 6,
      "description": "Verify updated UPGRADES.md accuracy and completeness",
      "source": "IMPLICIT",
      "status": "DONE",
      "parallel": true,
      "timestamp": "2026-01-10T02:55:30.294Z"
    }
  ],
  "log": [
    "[2026-01-10T02:54:56.240Z] ISC created for: validate UpdateSkill upgrade suggestions for Claude Code CLI context and update UPGRADES.md",
    "[2026-01-10T02:55:17.111Z] Added row 1: Understand Claude Code CLI vs Messages API architectural difference (EXPLICIT)",
    "[2026-01-10T02:55:19.664Z] Added row 2: Read and analyze current UPGRADES.md suggestions (EXPLICIT)",
    "[2026-01-10T02:55:22.323Z] Added row 3: Evaluate each upgrade for Claude Code CLI applicability (EXPLICIT)",
    "[2026-01-10T02:55:24.945Z] Added row 4: Identify which suggestions are valid, invalid, or need modification (INFERRED)",
    "[2026-01-10T02:55:27.693Z] Added row 5: Rewrite UPGRADES.md with corrected recommendations (EXPLICIT)",
    "[2026-01-10T02:55:30.294Z] Added row 6: Verify updated UPGRADES.md accuracy and completeness (IMPLICIT)",
    "[2026-01-10T02:55:41.164Z] Row 1: PENDING → ACTIVE",
    "[2026-01-10T02:55:56.888Z] Row 1: ACTIVE → DONE",
    "[2026-01-10T02:55:59.351Z] Row 2: PENDING → ACTIVE",
    "[2026-01-10T02:56:42.063Z] Row 2: ACTIVE → DONE",
    "[2026-01-10T02:56:44.798Z] Row 3: PENDING → ACTIVE",
    "[2026-01-10T02:57:09.956Z] Row 3: ACTIVE → DONE",
    "[2026-01-10T02:57:12.680Z] Row 4: PENDING → ACTIVE",
    "[2026-01-10T02:57:29.894Z] Row 4: ACTIVE → DONE",
    "[2026-01-10T02:57:32.521Z] Row 5: PENDING → ACTIVE",
    "[2026-01-10T02:59:44.444Z] Row 5: ACTIVE → DONE",
    "[2026-01-10T02:59:47.039Z] Row 6: PENDING → ACTIVE",
    "[2026-01-10T03:00:17.359Z] Row 6: ACTIVE → DONE"
  ]
}