{
  "request": "Upgrade UpdateSkill RefactorSkill.md with suggestion A1 using iterative loop until minimal changes",
  "effort": "THOROUGH",
  "created": "2026-01-10T03:29:24.667Z",
  "lastModified": "2026-01-10T03:41:11.887Z",
  "phase": "OBSERVE",
  "iteration": 1,
  "rows": [
    {
      "id": 1,
      "description": "Understand current RefactorSkill.md structure and content",
      "source": "EXPLICIT",
      "status": "DONE",
      "parallel": true,
      "timestamp": "2026-01-10T03:29:57.515Z"
    },
    {
      "id": 2,
      "description": "Understand A1 specification requirements fully",
      "source": "EXPLICIT",
      "status": "DONE",
      "parallel": true,
      "timestamp": "2026-01-10T03:30:00.011Z"
    },
    {
      "id": 3,
      "description": "Design Analysis Phase section (4 subsections: Structural, Usability, Compliance, Trade-offs)",
      "source": "EXPLICIT",
      "status": "DONE",
      "parallel": true,
      "timestamp": "2026-01-10T03:30:02.533Z"
    },
    {
      "id": 4,
      "description": "Design Decision Framework section with 5 documentation points",
      "source": "EXPLICIT",
      "status": "DONE",
      "parallel": true,
      "timestamp": "2026-01-10T03:30:05.054Z"
    },
    {
      "id": 5,
      "description": "Determine optimal placement in existing RefactorSkill.md workflow",
      "source": "INFERRED",
      "status": "DONE",
      "parallel": true,
      "timestamp": "2026-01-10T03:30:07.593Z"
    },
    {
      "id": 6,
      "description": "ITERATION 1: Implement changes to RefactorSkill.md",
      "source": "EXPLICIT",
      "status": "DONE",
      "parallel": true,
      "timestamp": "2026-01-10T03:30:10.100Z"
    },
    {
      "id": 7,
      "description": "ITERATION 1: Analyze improvements and identify issues",
      "source": "EXPLICIT",
      "status": "DONE",
      "parallel": true,
      "timestamp": "2026-01-10T03:30:12.583Z"
    },
    {
      "id": 8,
      "description": "ITERATION 1: Document issues found and update specifications",
      "source": "EXPLICIT",
      "status": "DONE",
      "parallel": true,
      "timestamp": "2026-01-10T03:30:15.163Z"
    },
    {
      "id": 9,
      "description": "Continue iterations (2, 3, ...) until changes are minimal",
      "source": "EXPLICIT",
      "status": "DONE",
      "parallel": true,
      "timestamp": "2026-01-10T03:30:17.675Z"
    },
    {
      "id": 10,
      "description": "Final verification: No obvious faults OR only single minor change remains",
      "source": "EXPLICIT",
      "status": "DONE",
      "parallel": true,
      "timestamp": "2026-01-10T03:30:20.324Z"
    },
    {
      "id": 11,
      "description": "Enhanced content follows UpdateSkill best practices",
      "source": "IMPLICIT",
      "status": "DONE",
      "parallel": true,
      "timestamp": "2026-01-10T03:30:23.067Z"
    },
    {
      "id": 12,
      "description": "New sections integrate seamlessly with existing workflow structure",
      "source": "IMPLICIT",
      "status": "DONE",
      "parallel": true,
      "timestamp": "2026-01-10T03:30:25.632Z"
    },
    {
      "id": 13,
      "description": "Markdown formatting is consistent and valid",
      "source": "IMPLICIT",
      "status": "DONE",
      "parallel": true,
      "timestamp": "2026-01-10T03:30:28.170Z"
    }
  ],
  "log": [
    "[2026-01-10T03:29:24.667Z] ISC created for: Upgrade UpdateSkill RefactorSkill.md with suggestion A1 using iterative loop until minimal changes",
    "[2026-01-10T03:29:57.515Z] Added row 1: Understand current RefactorSkill.md structure and content (EXPLICIT)",
    "[2026-01-10T03:30:00.011Z] Added row 2: Understand A1 specification requirements fully (EXPLICIT)",
    "[2026-01-10T03:30:02.533Z] Added row 3: Design Analysis Phase section (4 subsections: Structural, Usability, Compliance, Trade-offs) (EXPLICIT)",
    "[2026-01-10T03:30:05.054Z] Added row 4: Design Decision Framework section with 5 documentation points (EXPLICIT)",
    "[2026-01-10T03:30:07.593Z] Added row 5: Determine optimal placement in existing RefactorSkill.md workflow (INFERRED)",
    "[2026-01-10T03:30:10.100Z] Added row 6: ITERATION 1: Implement changes to RefactorSkill.md (EXPLICIT)",
    "[2026-01-10T03:30:12.583Z] Added row 7: ITERATION 1: Analyze improvements and identify issues (EXPLICIT)",
    "[2026-01-10T03:30:15.163Z] Added row 8: ITERATION 1: Document issues found and update specifications (EXPLICIT)",
    "[2026-01-10T03:30:17.675Z] Added row 9: Continue iterations (2, 3, ...) until changes are minimal (EXPLICIT)",
    "[2026-01-10T03:30:20.324Z] Added row 10: Final verification: No obvious faults OR only single minor change remains (EXPLICIT)",
    "[2026-01-10T03:30:23.067Z] Added row 11: Enhanced content follows UpdateSkill best practices (IMPLICIT)",
    "[2026-01-10T03:30:25.632Z] Added row 12: New sections integrate seamlessly with existing workflow structure (IMPLICIT)",
    "[2026-01-10T03:30:28.170Z] Added row 13: Markdown formatting is consistent and valid (IMPLICIT)",
    "[2026-01-10T03:30:43.484Z] Row 1: PENDING → DONE",
    "[2026-01-10T03:30:45.895Z] Row 2: PENDING → DONE",
    "[2026-01-10T03:31:05.536Z] Row 3: PENDING → ACTIVE",
    "[2026-01-10T03:32:21.093Z] Row 3: ACTIVE → DONE",
    "[2026-01-10T03:32:23.606Z] Row 4: PENDING → DONE",
    "[2026-01-10T03:32:26.079Z] Row 5: PENDING → DONE",
    "[2026-01-10T03:32:40.271Z] Row 6: PENDING → ACTIVE",
    "[2026-01-10T03:33:50.731Z] Row 6: ACTIVE → DONE",
    "[2026-01-10T03:33:53.256Z] Row 7: PENDING → ACTIVE",
    "[2026-01-10T03:36:08.769Z] Row 7: ACTIVE → DONE",
    "[2026-01-10T03:36:11.188Z] Row 8: PENDING → ACTIVE",
    "[2026-01-10T03:36:16.113Z] Row 8: ACTIVE → DONE",
    "[2026-01-10T03:36:20.436Z] Row 9: PENDING → ACTIVE",
    "[2026-01-10T03:37:08.465Z] Row 9: ACTIVE → DONE",
    "[2026-01-10T03:41:04.621Z] Row 10: PENDING → DONE",
    "[2026-01-10T03:41:07.057Z] Row 11: PENDING → DONE",
    "[2026-01-10T03:41:09.483Z] Row 12: PENDING → DONE",
    "[2026-01-10T03:41:11.887Z] Row 13: PENDING → DONE"
  ]
}